{
  "$schema": "http://json-schema.org/draft-07/schema#",
  "title": "Meta JSON Schema for versioned-md documents",
  "description": "Schema for companion .meta.json files that track version history",
  "type": "object",
  "required": ["version_history"],
  "properties": {
    "title": {
      "type": "string",
      "description": "Document title"
    },
    "description": {
      "type": "string",
      "description": "Document description"
    },
    "category": {
      "type": "string",
      "enum": ["strict", "draft", "retired", "reference"],
      "description": "Document category"
    },
    "documentId": {
      "type": "string",
      "description": "4-digit document ID for strict/draft documents; descriptive ID for reference documents"
    },
    "template": {
      "type": "boolean",
      "description": "True if this document and its metadata were included by versioned-md template generation"
    },
    "responsible": {
      "type": "string",
      "description": "Person handle responsible for this document"
    },
    "status": {
      "type": "string",
      "enum": ["active", "retired"],
      "default": "active",
      "description": "Document status"
    },
    "version": {
      "type": "string",
      "description": "Current version number"
    },
    "lastUpdated": {
      "type": "string",
      "format": "date",
      "pattern": "^[0-9]{4}-[0-9]{2}-[0-9]{2}$",
      "description": "Last update date in YYYY-MM-DD format"
    },
    "updatedBy": {
      "type": "string",
      "description": "Person handle who made the last update"
    },
    "reviewer": {
      "type": "array",
      "items": {
        "type": "string"
      },
      "description": "List of reviewer handles from people.json"
    },
    "commitHash": {
      "type": "string",
      "description": "Git commit SHA"
    },
    "prNumber": {
      "type": ["string", "null"],
      "description": "Pull request number as a string, or null"
    },
    "statusChangedBy": {
      "type": "string",
      "description": "Person handle who last changed status"
    },
    "version_history": {
      "type": "array",
      "items": {
        "type": "object",
        "required": ["version", "updated_by", "last_updated"],
        "properties": {
          "version": {
            "type": "string",
            "description": "Version number (e.g. '1', '42')"
          },
          "updated_by": {
            "type": "string",
            "description": "Person handle who made the change"
          },
          "last_updated": {
            "type": "string",
            "format": "date",
            "pattern": "^[0-9]{4}-[0-9]{2}-[0-9]{2}$",
            "description": "Date in YYYY-MM-DD format"
          },
          "reviewer": {
            "type": "array",
            "items": {
              "type": "string"
            },
            "description": "Reviewer handles from people.json"
          },
          "commit_hash": {
            "type": "string",
            "description": "Git commit SHA"
          },
          "pr_number": {
            "type": ["integer", "null"],
            "description": "Pull request number, or null if no PR"
          },
          "action": {
            "type": "string",
            "enum": ["created", "updated", "promoted", "imported"],
            "description": "Type of change for this version"
          }
        },
        "additionalProperties": false
      },
      "minItems": 0
    }
  },
  "additionalProperties": false
}

