{
  "title": "Getting Started",
  "description": "Creating a documentation repository from scratch and bootstrapping it for first use",
  "category": "reference",
  "documentId": "01-using-versioned-md",
  "status": "active",
  "version": "1",
  "lastUpdated": "2026-06-25",
  "updatedBy": "johannes",
  "reviewer": [
    "sarah",
    "mike"
  ],
  "commitHash": "",
  "prNumber": "",
  "template": true,
  "version_history": [
    {
      "version": "1",
      "last_updated": "2026-06-25",
      "updated_by": "johannes",
      "reviewer": [
        "sarah",
        "mike"
      ],
      "commit_hash": "",
      "action": "created"
    }
  ]
}
