{
  "title": "CI & Governance",
  "description": "The PR workflow, CI checks, and post-merge automation",
  "category": "reference",
  "documentId": "05-ci-and-governance",
  "status": "active",
  "version": "1",
  "lastUpdated": "2026-06-25",
  "updatedBy": "johannes",
  "reviewer": [
    "sarah",
    "mike"
  ],
  "commitHash": "",
  "prNumber": "",
  "template": true,
  "version_history": [
    {
      "version": "1",
      "last_updated": "2026-06-25",
      "updated_by": "johannes",
      "reviewer": [
        "sarah",
        "mike"
      ],
      "commit_hash": "",
      "action": "created"
    }
  ]
}
